{
  "event_id": "092507-007-sample-001",
  "event_type": "PRODUCT_REGISTERED",
  "aggregate_type": "product_version",
  "aggregate_id": "frozen_bread_clock-001",
  "occurred_at": "2026-09-24T12:00:00+08:00",
  "version": 1,
  "payload": {
    "product_id": "cream-toast-001",
    "recipe_version": 3,
    "lot_no": "L20260924",
    "produced_at": "2026-09-24T08:00:00+08:00",
    "allergens": ["麸质", "乳制品"],
    "filling": "奶油",
    "rules": {
      "ambient_hours": 8,
      "fridge_hours": 48,
      "freeze_window_hours": 24,
      "frozen_hours": 720,
      "thawed_ambient_hours": 4,
      "thawed_fridge_hours": 24,
      "refreeze_allowed": false,
      "warn_hours": 6,
      "reheat_methods": ["烤箱", "蒸锅"]
    }
  }
}
